{
  "$id": "urn:smart-home-simulator:schema:sensor-deployment-policy:1.0.0",
  "$schema": "https://json-schema.org/draft/2020-12/schema",
  "additionalProperties": false,
  "properties": {
    "schemaVersion": {
      "const": "1.0.0",
      "default": "1.0.0",
      "title": "Schemaversion",
      "type": "string"
    },
    "documentType": {
      "const": "sensor_deployment_policy",
      "default": "sensor_deployment_policy",
      "title": "Documenttype",
      "type": "string"
    },
    "policyVersion": {
      "default": "1.1.0",
      "enum": [
        "1.1.0",
        "1.2.0"
      ],
      "title": "Policyversion",
      "type": "string"
    },
    "preset": {
      "default": "room_coverage",
      "enum": [
        "minimal",
        "room_coverage",
        "dense",
        "functional_zones"
      ],
      "title": "Preset",
      "type": "string"
    },
    "observationProfile": {
      "default": "ideal",
      "enum": [
        "ideal",
        "realistic",
        "adverse"
      ],
      "title": "Observationprofile",
      "type": "string"
    },
    "pirHoldMilliseconds": {
      "default": 3500,
      "exclusiveMinimum": 0,
      "title": "Pirholdmilliseconds",
      "type": "number"
    },
    "pirHoldLogSigma": {
      "default": 0.0,
      "maximum": 2,
      "minimum": 0,
      "title": "Pirholdlogsigma",
      "type": "number"
    },
    "pirCooldownMilliseconds": {
      "default": 750,
      "minimum": 0,
      "title": "Pircooldownmilliseconds",
      "type": "number"
    },
    "pirCoverageShape": {
      "default": "rectangle",
      "enum": [
        "rectangle",
        "circle"
      ],
      "title": "Pircoverageshape",
      "type": "string"
    },
    "pirCoverageRadiusMeters": {
      "default": 0.0,
      "maximum": 12,
      "minimum": 0,
      "title": "Pircoverageradiusmeters",
      "type": "number"
    },
    "contactPulseMilliseconds": {
      "default": 1000,
      "exclusiveMinimum": 0,
      "title": "Contactpulsemilliseconds",
      "type": "number"
    },
    "contactPulseLogSigma": {
      "default": 0.0,
      "maximum": 2,
      "minimum": 0,
      "title": "Contactpulselogsigma",
      "type": "number"
    },
    "latencyMilliseconds": {
      "default": 0.0,
      "minimum": 0,
      "title": "Latencymilliseconds",
      "type": "number"
    },
    "clockJitterMilliseconds": {
      "default": 0.0,
      "minimum": 0,
      "title": "Clockjittermilliseconds",
      "type": "number"
    },
    "temperatureBaselineCelsius": {
      "default": 20.0,
      "maximum": 100,
      "minimum": -100,
      "title": "Temperaturebaselinecelsius",
      "type": "number"
    },
    "temperatureSampleIntervalSeconds": {
      "default": 900,
      "exclusiveMinimum": 0,
      "title": "Temperaturesampleintervalseconds",
      "type": "number"
    },
    "temperatureSourceDeltaCelsius": {
      "default": 0.5,
      "exclusiveMinimum": 0,
      "maximum": 20,
      "title": "Temperaturesourcedeltacelsius",
      "type": "number"
    },
    "temperatureQuantizationCelsius": {
      "default": 0.5,
      "exclusiveMinimum": 0,
      "maximum": 10,
      "title": "Temperaturequantizationcelsius",
      "type": "number"
    },
    "temperatureThermalTimeConstantHours": {
      "default": 0.0,
      "maximum": 72,
      "minimum": 0,
      "title": "Temperaturethermaltimeconstanthours",
      "type": "number"
    },
    "temperatureSeasonalCoupling": {
      "default": 0.0,
      "maximum": 1,
      "minimum": 0,
      "title": "Temperatureseasonalcoupling",
      "type": "number"
    },
    "temperatureReportingMode": {
      "default": "periodic",
      "enum": [
        "periodic",
        "on_change"
      ],
      "title": "Temperaturereportingmode",
      "type": "string"
    },
    "temperatureReportThresholdCelsius": {
      "default": 0.5,
      "exclusiveMinimum": 0,
      "maximum": 10,
      "title": "Temperaturereportthresholdcelsius",
      "type": "number"
    },
    "temperatureHeartbeatSeconds": {
      "default": 0.0,
      "minimum": 0,
      "title": "Temperatureheartbeatseconds",
      "type": "number"
    },
    "clockDriftPpmSpread": {
      "default": 0.0,
      "maximum": 500,
      "minimum": 0,
      "title": "Clockdriftppmspread",
      "type": "number"
    },
    "useCityClimate": {
      "default": false,
      "title": "Usecityclimate",
      "type": "boolean"
    },
    "staggerTemperatureSampling": {
      "default": false,
      "title": "Staggertemperaturesampling",
      "type": "boolean"
    },
    "dropoutProbability": {
      "default": 0.0,
      "maximum": 1,
      "minimum": 0,
      "title": "Dropoutprobability",
      "type": "number"
    },
    "falseNegativeProbability": {
      "default": 0.0,
      "maximum": 1,
      "minimum": 0,
      "title": "Falsenegativeprobability",
      "type": "number"
    },
    "falsePositiveProbabilityPerDay": {
      "default": 0.0,
      "maximum": 1,
      "minimum": 0,
      "title": "Falsepositiveprobabilityperday",
      "type": "number"
    },
    "temperatureNoiseStandardDeviation": {
      "default": 0.0,
      "minimum": 0,
      "title": "Temperaturenoisestandarddeviation",
      "type": "number"
    },
    "batteryDeathProbabilityPerYear": {
      "default": 0.0,
      "maximum": 1,
      "minimum": 0,
      "title": "Batterydeathprobabilityperyear",
      "type": "number"
    },
    "transientOutagesPerYear": {
      "default": 0.0,
      "maximum": 365,
      "minimum": 0,
      "title": "Transientoutagesperyear",
      "type": "number"
    },
    "transientOutageHours": {
      "default": 6.0,
      "exclusiveMinimum": 0,
      "maximum": 72,
      "title": "Transientoutagehours",
      "type": "number"
    }
  },
  "title": "Smart Home Deterministic Sensor Deployment Policy 1.0.0",
  "type": "object"
}
