{
  "schemaVersion": "1.0.0",
  "documentType": "sensor_deployment_policy",
  "policyVersion": "1.1.0",
  "preset": "room_coverage",
  "observationProfile": "ideal",
  "pirHoldMilliseconds": 3500.0,
  "pirHoldLogSigma": 0.0,
  "pirCooldownMilliseconds": 750.0,
  "pirCoverageShape": "rectangle",
  "pirCoverageRadiusMeters": 0.0,
  "contactPulseMilliseconds": 1000.0,
  "contactPulseLogSigma": 0.0,
  "latencyMilliseconds": 0.0,
  "clockJitterMilliseconds": 0.0,
  "temperatureBaselineCelsius": 20.0,
  "temperatureSampleIntervalSeconds": 900.0,
  "temperatureSourceDeltaCelsius": 0.5,
  "temperatureQuantizationCelsius": 0.5,
  "temperatureThermalTimeConstantHours": 0.0,
  "temperatureSeasonalCoupling": 0.0,
  "temperatureReportingMode": "periodic",
  "temperatureReportThresholdCelsius": 0.5,
  "temperatureHeartbeatSeconds": 0.0,
  "clockDriftPpmSpread": 0.0,
  "useCityClimate": false,
  "staggerTemperatureSampling": false,
  "dropoutProbability": 0.0,
  "falseNegativeProbability": 0.0,
  "falsePositiveProbabilityPerDay": 0.0,
  "temperatureNoiseStandardDeviation": 0.0,
  "batteryDeathProbabilityPerYear": 0.0,
  "transientOutagesPerYear": 0.0,
  "transientOutageHours": 6.0
}
