{
  "schemaVersion": "1.0.0",
  "documentType": "sensor_deployment_policy",
  "policyVersion": "1.2.0",
  "preset": "room_coverage",
  "observationProfile": "realistic",
  "pirHoldMilliseconds": 3500.0,
  "pirHoldLogSigma": 0.45,
  "pirCooldownMilliseconds": 750.0,
  "contactPulseMilliseconds": 5500.0,
  "contactPulseLogSigma": 0.65,
  "latencyMilliseconds": 80.0,
  "clockJitterMilliseconds": 250.0,
  "temperatureBaselineCelsius": 22.0,
  "temperatureSampleIntervalSeconds": 900.0,
  "temperatureSourceDeltaCelsius": 0.7,
  "temperatureQuantizationCelsius": 0.1,
  "temperatureThermalTimeConstantHours": 4.0,
  "useCityClimate": true,
  "staggerTemperatureSampling": true,
  "dropoutProbability": 0.005,
  "falseNegativeProbability": 0.02,
  "falsePositiveProbabilityPerDay": 0.15,
  "temperatureNoiseStandardDeviation": 0.12
}
